{
  "$schema": "../schemas/release-manifest.schema.json",
  "schemaVersion": 1,
  "releaseId": "document-harness-public-v1",
  "version": "1.8.0",
  "profiles": [
    "core",
    "governance",
    "view"
  ],
  "profileDependencies": {
    "core": [],
    "governance": ["core"],
    "view": ["core", "governance"]
  },
  "files": [
    {
      "sourcePath": "docs/_templates/adoption/agents.md",
      "targetPath": "docs/_templates/adoption/agents.md",
      "profiles": ["core"],
      "artifactType": "template"
    },
    {
      "sourcePath": "docs/_templates/adoption/docs-readme.md",
      "targetPath": "docs/_templates/adoption/docs-readme.md",
      "profiles": ["core"],
      "artifactType": "template"
    },
    {
      "sourcePath": "docs/_templates/adoption/adopt.md",
      "targetPath": "docs/_templates/adoption/adopt.md",
      "profiles": ["core"],
      "artifactType": "template"
    },
    {
      "sourcePath": "docs/_templates/adoption/execute.md",
      "targetPath": "docs/_templates/adoption/execute.md",
      "profiles": ["core"],
      "artifactType": "template"
    },
    {
      "sourcePath": "docs/_templates/adoption/control-plane.md",
      "targetPath": "docs/_templates/adoption/control-plane.md",
      "profiles": ["core"],
      "artifactType": "template"
    },
    {
      "sourcePath": "docs/_templates/adoption/ubiquitous-language.md",
      "targetPath": "docs/_templates/adoption/ubiquitous-language.md",
      "profiles": ["core"],
      "artifactType": "template"
    },
    {
      "sourcePath": "docs/_templates/adoption/domain-landscape.md",
      "targetPath": "docs/_templates/adoption/domain-landscape.md",
      "profiles": ["core"],
      "artifactType": "template"
    },
    {
      "sourcePath": "docs/_templates/adoption/context-map.md",
      "targetPath": "docs/_templates/adoption/context-map.md",
      "profiles": ["core"],
      "artifactType": "template"
    },
    {
      "sourcePath": "docs/_templates/claude.md",
      "targetPath": "docs/_templates/claude.md",
      "profiles": ["core"],
      "artifactType": "template"
    },
    {
      "sourcePath": "docs/_templates/adoption/agents.md",
      "targetPath": "AGENTS.md",
      "profiles": ["core"],
      "ownership": "project-owned"
    },
    {
      "sourcePath": "docs/_templates/claude.md",
      "targetPath": "CLAUDE.md",
      "profiles": ["core"],
      "ownership": "project-owned"
    },
    {
      "sourcePath": "docs/_templates/adoption/docs-readme.md",
      "targetPath": "docs/README.md",
      "profiles": ["core"],
      "ownership": "project-owned"
    },
    {
      "sourcePath": "docs/_templates/adoption/control-plane.md",
      "targetPath": "docs/architecture/control-plane.md",
      "profiles": ["core"],
      "ownership": "project-owned"
    },
    {
      "sourcePath": "docs/_templates/adoption/ubiquitous-language.md",
      "targetPath": "docs/architecture/harness-language.md",
      "profiles": ["core"],
      "ownership": "project-owned"
    },
    {
      "sourcePath": "docs/_indexes/context-packets.yaml",
      "targetPath": "docs/_indexes/context-packets.yaml",
      "profiles": ["core"],
      "ownership": "project-owned"
    },
    {
      "sourcePath": "docs/_indexes/execution-loop-policy.yaml",
      "targetPath": "docs/_indexes/execution-loop-policy.yaml",
      "profiles": ["core"]
    },
    {
      "sourcePath": "docs/_templates/execution-checkpoint.md",
      "targetPath": "docs/_templates/execution-checkpoint.md",
      "profiles": ["core"],
      "artifactType": "template"
    },
    {
      "sourcePath": "docs/_templates/project.md",
      "targetPath": "docs/_templates/project.md",
      "profiles": ["core"],
      "artifactType": "template"
    },
    {
      "sourcePath": "docs/_templates/initiative.md",
      "targetPath": "docs/_templates/initiative.md",
      "profiles": ["core"],
      "artifactType": "template"
    },
    {
      "sourcePath": "docs/_templates/task.md",
      "targetPath": "docs/_templates/task.md",
      "profiles": ["core"],
      "artifactType": "template"
    },
    {
      "sourcePath": "docs/_templates/design.md",
      "targetPath": "docs/_templates/design.md",
      "profiles": ["core"],
      "artifactType": "template"
    },
    {
      "sourcePath": "docs/_templates/design-domain-landscape.md",
      "targetPath": "docs/_templates/design-domain-landscape.md",
      "profiles": ["core"],
      "artifactType": "template"
    },
    {
      "sourcePath": "docs/_templates/design-context-map.md",
      "targetPath": "docs/_templates/design-context-map.md",
      "profiles": ["core"],
      "artifactType": "template"
    },
    {
      "sourcePath": "docs/_templates/design-ubiquitous-language.md",
      "targetPath": "docs/_templates/design-ubiquitous-language.md",
      "profiles": ["core"],
      "artifactType": "template"
    },
    {
      "sourcePath": "docs/_templates/design-examples.md",
      "targetPath": "docs/_templates/design-examples.md",
      "profiles": ["core"],
      "artifactType": "template"
    },
    {
      "sourcePath": "docs/_templates/domain-design-approval-receipt.json",
      "targetPath": "docs/_templates/domain-design-approval-receipt.json",
      "profiles": ["core"],
      "artifactType": "template"
    },
    {
      "sourcePath": "docs/_templates/ai-domain-modeling-receipt.json",
      "targetPath": "docs/_templates/ai-domain-modeling-receipt.json",
      "profiles": ["core"],
      "artifactType": "template"
    },
    {
      "sourcePath": "docs/_templates/domain-supervision-review.json",
      "targetPath": "docs/_templates/domain-supervision-review.json",
      "profiles": ["core"],
      "artifactType": "template"
    },
    {
      "sourcePath": "docs/_templates/domain-supervision-decision-receipt.json",
      "targetPath": "docs/_templates/domain-supervision-decision-receipt.json",
      "profiles": ["core"],
      "artifactType": "template"
    },
    {
      "sourcePath": "docs/_templates/domain-authority-delegation-receipt.json",
      "targetPath": "docs/_templates/domain-authority-delegation-receipt.json",
      "profiles": ["core"],
      "artifactType": "template"
    },
    {
      "sourcePath": "docs/_templates/human-presentation-review-receipt.json",
      "targetPath": "docs/_templates/human-presentation-review-receipt.json",
      "profiles": ["core"],
      "artifactType": "template"
    },
    {
      "sourcePath": "docs/_templates/guide.md",
      "targetPath": "docs/_templates/guide.md",
      "profiles": ["core"],
      "artifactType": "template"
    },
    {
      "sourcePath": "docs/_templates/report.md",
      "targetPath": "docs/_templates/report.md",
      "profiles": ["core"],
      "artifactType": "template"
    },
    {
      "sourcePath": "docs/_templates/qa.md",
      "targetPath": "docs/_templates/qa.md",
      "profiles": ["core"],
      "artifactType": "template"
    },
    {
      "sourcePath": "docs/_templates/document-harness.yaml",
      "targetPath": "docs/_templates/document-harness.yaml",
      "profiles": ["core"],
      "artifactType": "template"
    },
    {
      "sourcePath": "docs/_templates/document-harness.yaml",
      "targetPath": "document-harness.yaml",
      "profiles": ["core"],
      "generator": "repository-adoption-profile-v1",
      "artifactType": "generated"
    },
    {
      "sourcePath": "docs/_templates/governance-catalog.json",
      "targetPath": "docs/_templates/governance-catalog.json",
      "profiles": ["governance", "view"],
      "artifactType": "template"
    },
    {
      "sourcePath": "docs/_templates/governance-catalog.json",
      "targetPath": "docs/_indexes/governance-catalog.json",
      "profiles": ["governance", "view"],
      "generator": "repository-governance-catalog-v1",
      "artifactType": "generated"
    },
    {
      "sourcePath": "docs/_templates/initiative-register.json",
      "targetPath": "docs/_templates/initiative-register.json",
      "profiles": ["governance", "view"],
      "artifactType": "template"
    },
    {
      "sourcePath": "docs/_templates/initiative-register.json",
      "targetPath": "docs/_indexes/initiative-register.json",
      "profiles": ["governance", "view"],
      "ownership": "project-owned",
      "artifactType": "generated"
    },
    {
      "sourcePath": "docs/_templates/adoption/human-policy-decision-receipt.json",
      "targetPath": "docs/_templates/adoption/human-policy-decision-receipt.json",
      "profiles": ["governance"],
      "artifactType": "template"
    },
    {
      "sourcePath": "docs/_templates/initiative-activation-receipt.json",
      "targetPath": "docs/_templates/initiative-activation-receipt.json",
      "profiles": ["core"],
      "artifactType": "template"
    },
    {
      "sourcePath": "docs/_templates/view-runtime.json",
      "targetPath": "docs/_templates/view-runtime.json",
      "profiles": ["view"],
      "artifactType": "template"
    },
    {
      "sourcePath": ".agents/skills/operate-document-harness/SKILL.md",
      "targetPath": ".agents/skills/operate-document-harness/SKILL.md",
      "profiles": ["core"]
    },
    {
      "sourcePath": ".agents/skills/operate-document-harness/agents/openai.yaml",
      "targetPath": ".agents/skills/operate-document-harness/agents/openai.yaml",
      "profiles": ["core"]
    },
    {
      "sourcePath": ".claude/skills/operate-document-harness/SKILL.md",
      "targetPath": ".claude/skills/operate-document-harness/SKILL.md",
      "profiles": ["core"]
    },
    {
      "sourcePath": "docs/_templates/adoption/adopt.md",
      "targetPath": "docs/ADOPT.md",
      "profiles": ["core"]
    },
    {
      "sourcePath": "docs/_templates/adoption/execute.md",
      "targetPath": "docs/EXECUTE.md",
      "profiles": ["core"]
    },
    {
      "sourcePath": "docs/bin/harness-adopt",
      "targetPath": "docs/bin/harness-adopt",
      "profiles": ["core"],
      "mode": "0755"
    },
    {